{
  "audit_version": "AUDIT_BIBLE_v2",
  "generated_at": "2026-03-14T02:28:29Z",
  "project_type": "Next.js API + React frontend + Supabase sync layer",
  "audit_modes": [
    "security",
    "reliability",
    "integrity",
    "maintainability"
  ],
  "depth": "standard",
  "risk_tolerance": "production",
  "changed_since": "HEAD~2",
  "scope": {
    "in_scope": [
      "app/api/user/platform-state/route.ts",
      "lib/sync-queue.ts",
      "lib/api/user-session.ts",
      "lib/admin-supabase-client.ts",
      "tests/api/user-endpoints.test.ts",
      "tests/sync-queue.test.ts",
      "scripts/ci/release-smoke.mjs",
      "package.json",
      "supabase/migrations/001_initial_schema.sql",
      "supabase/migrations/019_align_gameplay_contracts.sql"
    ],
    "out_of_scope": [
      "other /api/user/* sync routes",
      "student/admin UI flows",
      "non-sync Supabase access patterns",
      "content audits"
    ]
  },
  "baseline_snapshot": [
    "Current hotfix head under review is 4a20bf3 after b0645eb.",
    "platform_states still uses a canonical unique contract on (user_id, platform_id).",
    "Migration 019 adds current_scene, global_flags, and patterns but does not change uniqueness.",
    "Focused tests passed: npx vitest run tests/api/user-endpoints.test.ts tests/sync-queue.test.ts -> 2 files, 63 tests passed.",
    "Production health is green: /api/health returned healthy on 2026-03-14T02:28:56Z.",
    "Production DB health is green: /api/health/db returned healthy on 2026-03-14T02:28:57Z.",
    "Release smoke currently checks health, unauthenticated session, unauthenticated advisor briefing, and CSP only.",
    "User-provided production console logs on 2026-03-13 showed repeated POST /api/user/platform-state 500s and repeated sync retries."
  ],
  "findings": [
    {
      "id": "F-001",
      "title": "SyncQueue does not persist incremented retry counts for transient failures",
      "severity": "P1",
      "category": "reliability",
      "issue_type": "code_defect",
      "certainty": "observed",
      "evidence_grade": "E0",
      "impact": "Transient sync failures can remain effectively immortal in the queue, causing repeated retries, noisy logs, and unnecessary user-facing degradation.",
      "evidence": [
        "lib/sync-queue.ts:743-787 increments retries into failedActions but persists remainingQueue instead of the incremented copies.",
        "tests/sync-queue.test.ts:383-441 only asserts retries >= 0 rather than asserting incremented retry state.",
        "Focused run passed despite the gap: npx vitest run tests/api/user-endpoints.test.ts tests/sync-queue.test.ts -> 63 tests passed."
      ],
      "root_cause": "Retry bookkeeping is updated in a temporary failedActions list but never written back into persisted queue state.",
      "fix": "Persist incremented failed actions back into the queue and add explicit tests for retry increments and max-retry eviction.",
      "verification": [
        "Add a test that a 500 response changes stored retries from 0 to 1.",
        "Add a test that an action is removed after the configured max retries.",
        "Run npx vitest run tests/sync-queue.test.ts."
      ],
      "prod_verification": [
        "Historical user console logs on 2026-03-13 showed repeated retry warnings for the same sync surface.",
        "Current audit did not inspect persisted retry counters directly in production."
      ]
    },
    {
      "id": "F-002",
      "title": "/api/user/platform-state accepts raw unknown fields and turns malformed payloads into server errors",
      "severity": "P2",
      "category": "reliability",
      "issue_type": "code_defect",
      "certainty": "observed",
      "evidence_grade": "E1",
      "impact": "Malformed or off-version client payloads become 500s instead of 400s, which obscures blame and drives unnecessary retries.",
      "evidence": [
        "app/api/user/platform-state/route.ts:40-69 casts the body to Record<string, unknown> and forwards current_scene, global_flags, and patterns without schema validation.",
        "User-provided production logs from 2026-03-13 showed repeated POST https://lux-story.vercel.app/api/user/platform-state 500 responses and sync retry warnings.",
        "tests/api/user-endpoints.test.ts:97-184 has no invalid-payload coverage for platform-state."
      ],
      "root_cause": "The route relies on database rejection instead of validating request shape at the API boundary.",
      "fix": "Add strict request validation for platform-state payloads and return 400s before profile ensure or database writes.",
      "verification": [
        "Add tests for invalid global_flags, invalid patterns, and oversized bodies returning 400.",
        "Run npx vitest run tests/api/user-endpoints.test.ts.",
        "Manual smoke: invalid platform-state POST returns 400 with a validation error."
      ],
      "prod_verification": [
        "Historical production logs showed this route returning 500 before the hotfix.",
        "Current audit rechecked only /api/health and /api/health/db, not the invalid-payload path on prod."
      ]
    },
    {
      "id": "F-003",
      "title": "Release verification omits the authenticated platform-state write path",
      "severity": "P2",
      "category": "reliability",
      "issue_type": "process_gap",
      "certainty": "observed",
      "evidence_grade": "E0",
      "impact": "Authenticated route or schema drift can pass release verification and only fail in live sessions.",
      "evidence": [
        "package.json:48-52 wires deploy through release:gate only.",
        "package.json:105 defines verify:release-smoke but it is not part of release:gate or deploy.",
        "scripts/ci/release-smoke.mjs:69-107 checks health and unauthenticated paths only."
      ],
      "root_cause": "Release verification is health-oriented and unauthenticated while the broken path was authenticated and stateful.",
      "fix": "Add authenticated profile bootstrap plus platform-state write/read smoke coverage to release verification.",
      "verification": [
        "Extend release-smoke to exercise authenticated POST /api/user/profile and POST/GET /api/user/platform-state.",
        "Confirm release verification fails when the platform-state contract is intentionally broken in a local branch."
      ],
      "prod_verification": [
        "Current production health endpoints are healthy, but current automated smoke still does not cover authenticated write paths."
      ]
    },
    {
      "id": "F-004",
      "title": "platform-state tests do not assert the live table contract or invalid-body behavior",
      "severity": "P2",
      "category": "reliability",
      "issue_type": "test_gap",
      "certainty": "observed",
      "evidence_grade": "E2",
      "impact": "Tests can stay green while the route drifts away from the actual table contract or returns the wrong error class for malformed input.",
      "evidence": [
        "tests/api/user-endpoints.test.ts:20-45 uses a generic mocked Supabase chain that does not inspect upsert payload or onConflict options.",
        "tests/api/user-endpoints.test.ts:110-137 only asserts 200 success and ensurePlayerProfile call.",
        "tests/api/user-endpoints.test.ts:152-166 allows a minimal payload but does not test malformed gameplay fields.",
        "Focused run passed: npx vitest run tests/api/user-endpoints.test.ts tests/sync-queue.test.ts -> 63 tests passed."
      ],
      "root_cause": "Route tests are centered on response status and auth gates rather than contract details and boundary behavior.",
      "fix": "Capture upsert payload and options in tests and add invalid-body assertions.",
      "verification": [
        "Add tests that assert platform_id = global, onConflict = user_id,platform_id, and invalid payloads return 400.",
        "Run npx vitest run tests/api/user-endpoints.test.ts."
      ],
      "prod_verification": [
        "Historical production incident escaped the current test suite before hotfix."
      ]
    },
    {
      "id": "F-005",
      "title": "Admin service-role helper is still not guarded as server-only",
      "severity": "P2",
      "category": "maintainability",
      "issue_type": "code_defect",
      "certainty": "observed",
      "evidence_grade": "E1",
      "impact": "A future accidental client import can reintroduce browser warnings or server-only assumptions into client bundles.",
      "evidence": [
        "lib/admin-supabase-client.ts:1-23 has no import 'server-only' guard despite exposing service-role client creation.",
        "lib/admin-supabase-client.ts:207-219 logs missing SUPABASE_SERVICE_ROLE_KEY warnings when imported without server envs.",
        "User-provided browser logs from 2026-03-13 showed [AdminSupabase] Missing env vars: SUPABASE_SERVICE_ROLE_KEY. Database operations will be skipped."
      ],
      "root_cause": "Server-only capability is enforced by convention instead of module-level import boundaries.",
      "fix": "Add import 'server-only' and separate any browser-safe helpers from the service-role module.",
      "verification": [
        "Run npm run build.",
        "Add a check that client modules cannot import admin-supabase-client.",
        "Verify a fresh browser session no longer shows the admin env warning."
      ],
      "prod_verification": [
        "Historical browser warning was observed before the hotfix.",
        "Current audit did not reproduce the warning on the latest bundle."
      ]
    }
  ],
  "root_cause_clusters": [
    {
      "id": "RC-001",
      "title": "Boundary contract hardening gap",
      "summary": "The platform-state route is loosely validated at the API edge and loosely asserted in tests, so malformed payloads and contract drift surface as runtime incidents instead of deterministic failures.",
      "finding_ids": [
        "F-002",
        "F-004"
      ],